{
  "$schema": "http://json-schema.org/draft-07/schema#",
  "additionalProperties": true,
  "properties": {
    "contractVersion": {
      "description": "Strict semver contract version carried by every wire object. Decoders accept the same major version; any other version is a typed error.",
      "pattern": "^(0|[1-9]\\d*)\\.(0|[1-9]\\d*)\\.(0|[1-9]\\d*)(?:-[0-9A-Za-z-]+(?:\\.[0-9A-Za-z-]+)*)?(?:\\+[0-9A-Za-z-]+(?:\\.[0-9A-Za-z-]+)*)?$",
      "type": "string"
    },
    "denials": {
      "description": "Typed denials the adapter MUST surface with their reason codes — every denial is explicit, never silent.",
      "items": {
        "additionalProperties": true,
        "properties": {
          "action": {
            "description": "The denied action scope (open vocabulary, e.g. `reality:write`, `evidence:submit`).",
            "maxLength": 256,
            "minLength": 1,
            "type": "string"
          },
          "reasonCode": {
            "description": "Stable denial reason code (open vocabulary; advisory well-known values: not-authenticated, forbidden-role, missing-permission, cross-tenant, revoked, expired). Rendered verbatim.",
            "maxLength": 256,
            "minLength": 1,
            "type": "string"
          },
          "reasonDetail": {
            "description": "Human-readable supplement; never replaces the stable reason code.",
            "maxLength": 4096,
            "minLength": 1,
            "type": "string"
          }
        },
        "required": [
          "action",
          "reasonCode"
        ],
        "type": "object"
      },
      "type": "array"
    },
    "grantedActions": {
      "description": "Action scopes the server grants (open vocabulary; e.g. `reality:read`, `evidence:submit`). Server-decided; the client never extends this list.",
      "items": {
        "maxLength": 256,
        "minLength": 1,
        "type": "string"
      },
      "type": "array"
    },
    "subjectRef": {
      "description": "The principal/session this authorization context is about.",
      "maxLength": 256,
      "minLength": 1,
      "type": "string"
    },
    "validUntil": {
      "description": "When the server's authorization answer expires, when stated.",
      "pattern": "^\\d{4}-\\d{2}-\\d{2}T\\d{2}:\\d{2}:\\d{2}\\.\\d{3}Z$",
      "type": "string"
    }
  },
  "required": [
    "contractVersion",
    "subjectRef",
    "grantedActions",
    "denials"
  ],
  "type": "object"
}
